{
  "schemaVersion": 1,
  "experimentId": "issue12-sdms-cross-object-business-01",
  "snapshotContentId": "sha256:3357ee63204ff863aac116417927240930084dce0eb7613126ad88cff68a424d",
  "questionSetSha256": "80ea873a00c1c97f003b07a7304852fc9baed6983762bdcf6ae2d44eeaf279a5",
  "client": {
    "name": "hermes-bounded-frontier",
    "version": "1.0"
  },
  "answers": [
    {
      "questionId": "Q1",
      "answer": "Статически прослеживаемый сценарий начинается с POST к HTTP-сервису API по шаблону /api/devrequests/{id}/{method}: обработчик приводит method к нижнему регистру и только при значении tasks вызывает создание задачи от заявки. Обязателен параметр system; due и customer необязательны. Создание отклоняется для служебного пользователя, неразрешимого идентификатора/параметров, автора вне IT, отсутствующей в заявке системы, черновика, отклоненной системы, срока не позже начала текущего дня, отклоненного основания либо завершенных более пяти дней назад работ по заявке. При успехе записывается подчиненный Документ.Задача: новый номер и статус «Новый», основание-заявка, выбранная система, заказчик, автор, филиал и команда автора, а содержательные поля наследуются из заявки; срок передается дополнительным свойством. После записи статически видны обновление процесса/срока и регистрация связей. API формирует ответ с id, номером и основными представлениями. Это статическая трассировка, а не подтверждение публикации сервиса или успешного runtime-запроса.",
      "facts": [
        {"id": "F1", "text": "Метаданные определяют HTTP-сервис API с RootURL api и POST-маршрут /devrequests/{id}/{method}, связанный с обработчиком devRequestsIdPOST."},
        {"id": "F2", "text": "Обработчик devRequestsIdPOST после общей предварительной проверки приводит URL-параметр method к нижнему регистру; значение tasks направляет запрос в API.СоздатьЗадачуОтЗаявки, прочие значения — в стандартный ответ неизвестной операции."},
        {"id": "F3", "text": "API.СоздатьЗадачуОтЗаявки отклоняет служебного пользователя, неразрешимый идентификатор заявки и невалидные параметры, затем вызывает менеджер заявки; успешный результат превращается в данные задачи, неуспешный — в ответ с текстом ошибки."},
        {"id": "F4", "text": "Для назначения СоздатьЗадачуОтЗаявки параметр system преобразуется в СистемаУчета и обязателен; due/СрокСдачи и customer/Заказчик необязательны."},
        {"id": "F5", "text": "Менеджер заявки допускает автора задачи только из IT-структуры/IT-отдела; выбранная система должна присутствовать в табличной части СистемыРазработки заявки, иначе возвращается ошибка."},
        {"id": "F6", "text": "Создание отклоняется, если заявка — черновик, статус выбранной системы — Отклонен, либо заполненный срок сдачи не больше начала текущего дня."},
        {"id": "F7", "text": "Дополнительная общая проверка запрещает создание при черновике основания, финальном статусе основания Отклонен и когда регистр минимальных статусов показывает Решен/Отклонен более пяти дней назад."},
        {"id": "F8", "text": "При успехе создается Документ.Задача с новой ссылкой и номером: дата текущая, статус Новый, система из запроса, основание — исходная заявка, заказчик — из запроса или автор заявки; назначение, серьезность, наименование, направление, описание и вид процесса наследуются из заявки; автор, филиал и команда берутся из текущего пользователя."},
        {"id": "F9", "text": "Если срок заполнен, он передается как дополнительное свойство СрокСдачи; задача записывается, ошибка записи журналируется и возвращает неуспех, а при успехе возвращается ссылка задачи."},
        {"id": "F10", "text": "Объектный модуль перед записью повторно вызывает общую проверку возможности создания; при записи статически видны изменение процессного статуса, сохранение срока, добавление участников/верхнего уровня для нового объекта, связь задачи с заявкой и постановка задания пересчитать число подчиненных задач."},
        {"id": "F11", "text": "Успешный API-ответ строится чтением записанной задачи и содержит id, короткий number, name, date, status, system, base, customer, direction, process, author и department."}
      ],
      "inferences": [
        {"id": "I1", "text": "Совокупность метаданных и обработчиков статически задает требуемую операцию как POST /api/devrequests/{id}/tasks."},
        {"id": "I2", "text": "Успешная ветвь статически представляет создание одной подчиненной задачи по одной системе исходной заявки, а не изменение самой заявки."},
        {"id": "I3", "text": "Вызов НоваяЗадача.Записать() статически делает достижимыми обработчики объектного модуля и перечисленные вторичные записи/очереди, если платформа исполняет стандартный жизненный цикл записи без исключения."}
      ],
      "assumptions": [],
      "unknowns": [
        {"id": "U1", "text": "Snapshot не подтверждает фактическую публикацию /api, доступность HTTP endpoint, сетевую конфигурацию, аутентификацию и успешный внешний вызов; нужны runtime-конфигурация публикации и журнал реального запроса."},
        {"id": "U2", "text": "Фактические значения текущего пользователя, его IT-признаков/филиала/команды, состояния заявки, системных статусов и регистра минимальных статусов требуют runtime-чтения данных конкретной информационной базы."},
        {"id": "U3", "text": "Фактическая атомарность, выполнение всех обработчиков/вторичных записей и отсутствие исключений требуют runtime-теста в копии базы с проверкой созданной задачи и затронутых регистров."}
      ],
      "locators": [
        {"path": "HTTPServices/API.xml", "startLine": 3, "endLine": 14, "claimIds": ["F1", "I1"]},
        {"path": "HTTPServices/API.xml", "startLine": 459, "endLine": 526, "claimIds": ["F1", "I1"]},
        {"path": "HTTPServices/API/Ext/Module.bsl", "startLine": 262, "endLine": 281, "claimIds": ["F2", "I1"]},
        {"path": "CommonModules/API/Ext/Module.bsl", "startLine": 995, "endLine": 1020, "claimIds": ["F3", "I2"]},
        {"path": "CommonModules/API/Ext/Module.bsl", "startLine": 5085, "endLine": 5088, "claimIds": ["F4"]},
        {"path": "Documents/ЗаявкаНаРазработку/Ext/ManagerModule.bsl", "startLine": 376, "endLine": 434, "claimIds": ["F5", "F6", "F7"]},
        {"path": "Documents/ЗаявкаНаРазработку/Ext/ManagerModule.bsl", "startLine": 436, "endLine": 473, "claimIds": ["F8", "F9", "I2", "I3"]},
        {"path": "Documents/ЗаявкаНаРазработку/Ext/ManagerModule.bsl", "startLine": 813, "endLine": 869, "claimIds": ["F5", "F8"]},
        {"path": "Documents/Задача/Ext/ManagerModule.bsl", "startLine": 78, "endLine": 114, "claimIds": ["F7"]},
        {"path": "InformationRegisters/МинимальныеСтатусыЗаявок/Ext/ManagerModule.bsl", "startLine": 208, "endLine": 232, "claimIds": ["F7"]},
        {"path": "Documents/Задача/Ext/ObjectModule.bsl", "startLine": 51, "endLine": 63, "claimIds": ["F10", "I3"]},
        {"path": "Documents/Задача/Ext/ObjectModule.bsl", "startLine": 281, "endLine": 335, "claimIds": ["F10", "I3"]},
        {"path": "CommonModules/API/Ext/Module.bsl", "startLine": 10846, "endLine": 10893, "claimIds": ["F11"]}
      ]
    }
  ],
  "metrics": {
    "status": "DONE",
    "evidenceMode": "blind-bounded-frontier-direct-filesystem",
    "selectedFileCount": 7,
    "selectedFragmentCount": 13,
    "selectedLineCount": 462,
    "selectedContextBytes": 30448,
    "runtimeExecuted": false
  }
}
