{
  "schemaVersion": 1,
  "experimentId": "issue12-sdms-cross-object-business-01",
  "snapshotContentId": "sha256:3357ee63204ff863aac116417927240930084dce0eb7613126ad88cff68a424d",
  "questionSetSha256": "80ea873a00c1c97f003b07a7304852fc9baed6983762bdcf6ae2d44eeaf279a5",
  "client": {
    "name": "hermes-direct-source",
    "version": "gpt-5.6-sol"
  },
  "answers": [
    {
      "questionId": "Q1",
      "answer": "Статически восстанавливаемый сценарий таков. Операция адресуется POST-запросом к `/api/devrequests/{id}/{method}`; обработчик нормализует `method` в нижний регистр и только при значении `tasks` передает идентификатор заявки и query-параметры в создание задачи (HTTPServices/API.xml:459-526; HTTPServices/API/Ext/Module.bsl:262-281). До бизнес-операции отсекаются служебный пользователь, неразрешимый идентификатор заявки и некорректные параметры; для операции разбираются система учета, необязательные срок сдачи и заказчик (CommonModules/API/Ext/Module.bsl:995-1013,5085-5088). Бизнес-отказ происходит, если текущий автор не относится к IT; указанной системы нет в заявке; заявка — черновик; статус выбранной системы — «Отклонен»; срок сдачи не позже начала текущего дня; объект-основание имеет финальный статус «Отклонен»; либо работы по заявке завершены — в коде это статус «Решен» или «Отклонен», сохраняющийся более 5 дней (Documents/ЗаявкаНаРазработку/Ext/ManagerModule.bsl:376-434,813-869; Documents/Задача/Ext/ManagerModule.bsl:78-114; InformationRegisters/МинимальныеСтатусыЗаявок/Ext/ManagerModule.bsl:200-232). При прохождении проверок формируется и записывается документ `Задача`: новый статус, назначение/серьезность/название/направление/описание/вид процесса из заявки, выбранная система, ссылка на заявку как основание, заказчик (из запроса либо автор заявки), текущий пользователь как автор, его филиал и команда; срок сдачи передается дополнительным свойством (Documents/ЗаявкаНаРазработку/Ext/ManagerModule.bsl:419-471). После успешной записи API возвращает данные задачи, включая id, номер, название, дату, статус, систему, основание, заказчика, направление, процесс, автора и подразделение (CommonModules/API/Ext/Module.bsl:1013-1020,10846-10893). Это вывод статического анализа: snapshot не доказывает публикацию сервиса, прохождение аутентификации, фактические данные конкретной заявки или успешную запись в живой базе; это требует runtime-проверки.",
      "facts": [
        {
          "id": "F1",
          "text": "HTTP-операция создания задачи из заявки определяется маршрутом POST /api/devrequests/{id}/{method}: обработчик приводит method к нижнему регистру и при method=tasks вызывает СоздатьЗадачуОтЗаявки с id и параметрами запроса; иное значение получает стандартный ответ неизвестной операции."
        },
        {
          "id": "F2",
          "text": "До вызова доменной операции общий API-код отклоняет служебного пользователя, неразрешимый id заявки и набор параметров, который не удалось разобрать."
        },
        {
          "id": "F3",
          "text": "Для СоздатьЗадачуОтЗаявки API отображает query-параметр system в СистемаУчета, а due и customer — в необязательные СрокСдачи и Заказчик."
        },
        {
          "id": "F4",
          "text": "Автором создаваемой задачи берется текущий пользователь; создание отклоняется, если его данные не получены либо он не относится к IT-структуре/IT-отделу."
        },
        {
          "id": "F5",
          "text": "Выбранная система должна присутствовать в табличной части СистемыРазработки указанной заявки; иначе возвращается ошибка «В заявке отсутствует указанная система»."
        },
        {
          "id": "F6",
          "text": "Создание отклоняется для заявки-черновика и для выбранной системы со статусом Отклонен."
        },
        {
          "id": "F7",
          "text": "Срок сдачи берется из запроса, а при его отсутствии — из срока реализации заявки; заполненный срок должен быть строго позже начала текущего дня. Заказчик аналогично берется из запроса, иначе используется автор заявки."
        },
        {
          "id": "F8",
          "text": "Общая проверка основания дополнительно запрещает создание для черновика, финального статуса Отклонен и завершенных работ; завершенность определяется наличием в регистре статуса Решен или Отклонен, от даты изменения которого прошло более 5 дней."
        },
        {
          "id": "F9",
          "text": "При прохождении проверок создается документ Задача со статусом Новый; из заявки переносятся назначение, серьезность ошибки, наименование, направление, описание и вид процесса; записываются выбранная система, заявка как ОбъектОснование, заказчик, текущий пользователь как автор, филиал и команда автора, а срок сдачи помещается в ДополнительныеСвойства."
        },
        {
          "id": "F10",
          "text": "Статический путь вызывает Записать для нового документа; исключение записи преобразуется в неуспех «Не удалось записать задачу», а при отсутствии исключения в результат помещается ссылка задачи."
        },
        {
          "id": "F11",
          "text": "После доменного успеха API формирует ответ успеха из записанной задачи с полями id, number, name, date, status, system, base, customer, direction, process, author и department; доменный неуспех преобразуется в ответ с кодом 17 и текстом ошибки."
        }
      ],
      "inferences": [],
      "assumptions": [],
      "unknowns": [
        {
          "id": "U1",
          "text": "Snapshot не подтверждает, что HTTP-сервис опубликован в конкретной среде, маршрут достижим и внешний вызов проходит реальную аутентификацию/ПередОбработкойЗапроса."
        },
        {
          "id": "U2",
          "text": "Без runtime-запуска неизвестны фактические данные пользователя, заявки, статусов и регистра, поэтому нельзя утверждать, что конкретный запрос пройдет перечисленные проверки."
        },
        {
          "id": "U3",
          "text": "Статический вызов Записать не доказывает успешную фиксацию в живой базе: нужны runtime-проверка обработчиков записи, прав, обязательных данных, транзакционного результата и фактического ответа API."
        }
      ],
      "locators": [
        {
          "path": "HTTPServices/API.xml",
          "startLine": 459,
          "endLine": 526,
          "claimIds": ["F1"]
        },
        {
          "path": "HTTPServices/API/Ext/Module.bsl",
          "startLine": 262,
          "endLine": 281,
          "claimIds": ["F1"]
        },
        {
          "path": "CommonModules/API/Ext/Module.bsl",
          "startLine": 995,
          "endLine": 1020,
          "claimIds": ["F2", "F10", "F11"]
        },
        {
          "path": "CommonModules/API/Ext/Module.bsl",
          "startLine": 5085,
          "endLine": 5088,
          "claimIds": ["F3"]
        },
        {
          "path": "Documents/ЗаявкаНаРазработку/Ext/ManagerModule.bsl",
          "startLine": 376,
          "endLine": 475,
          "claimIds": ["F4", "F6", "F7", "F8", "F9", "F10"]
        },
        {
          "path": "Documents/ЗаявкаНаРазработку/Ext/ManagerModule.bsl",
          "startLine": 813,
          "endLine": 869,
          "claimIds": ["F5", "F6", "F9"]
        },
        {
          "path": "Documents/Задача/Ext/ManagerModule.bsl",
          "startLine": 78,
          "endLine": 114,
          "claimIds": ["F8"]
        },
        {
          "path": "InformationRegisters/МинимальныеСтатусыЗаявок/Ext/ManagerModule.bsl",
          "startLine": 200,
          "endLine": 232,
          "claimIds": ["F8"]
        },
        {
          "path": "CommonModules/API/Ext/Module.bsl",
          "startLine": 10846,
          "endLine": 10893,
          "claimIds": ["F11"]
        }
      ]
    }
  ],
  "metrics": {
    "status": "DONE",
    "analysisMode": "blind-direct-filesystem-static"
  }
}
